{
  "schema": "vulcanary.experimental-dataflow.v1",
  "experimental": true,
  "policy_effect": "none",
  "max_call_depth": 3,
  "exposures": [
    {
      "fingerprint": "089709b5fa32d5ee88dc",
      "rule_id": "PY-DATAFLOW-CODE-INJECTION",
      "path": "app.py",
      "line": 3,
      "sink": "eval",
      "sources": [
        "request.args.get@2"
      ],
      "sanitizers": [],
      "confidence": "high",
      "experimental": true,
      "lifecycle": "prototype_only"
    }
  ],
  "analysis_truncations": [],
  "unmodeled_constructs": [],
  "unmodeled_construct_count": 0,
  "parse_errors": 0,
  "analysis_limits": [],
  "analyzed_modules": 1,
  "analyzed_calls": 1,
  "analysis_budget": {
    "max_modules": 10000,
    "max_calls": 1000000,
    "timeout_seconds": 120
  }
}
